{
  "repository_type": "global_impact_production_repository",
  "repository_version": "1.10.0",
  "workspace_id": "gic-workspace-bdc75d8b68333af2",
  "generated_at": "2026-07-17T23:35:00+00:00",
  "locales": [
    {
      "locale_code": "de",
      "workspace_id": "gic-workspace-bdc75d8b68333af2",
      "name": "Deutsch",
      "direction": "ltr",
      "fallback_locale": null,
      "active": true,
      "created_at": "2026-07-17T23:25:16.564278+00:00",
      "updated_at": "2026-07-17T23:25:16.564278+00:00",
      "translations": {
        "status.ready": "Bereit"
      },
      "metadata": {}
    },
    {
      "locale_code": "en-US",
      "workspace_id": null,
      "name": "English (United States)",
      "direction": "ltr",
      "fallback_locale": null,
      "active": true,
      "created_at": "2026-07-17T23:25:16.547953+00:00",
      "updated_at": "2026-07-17T23:25:16.547953+00:00",
      "translations": {
        "boundary.assurance": "This record is not assurance, certification, or causal proof.",
        "impact.title": "Global Impact Catalyst",
        "offline.available": "Available offline",
        "status.needs_attention": "Needs attention",
        "status.ready": "Ready"
      },
      "metadata": {
        "seeded": true
      }
    },
    {
      "locale_code": "es",
      "workspace_id": null,
      "name": "Español",
      "direction": "ltr",
      "fallback_locale": "en-US",
      "active": true,
      "created_at": "2026-07-17T23:25:16.547953+00:00",
      "updated_at": "2026-07-17T23:25:16.547953+00:00",
      "translations": {
        "boundary.assurance": "Este registro no constituye aseguramiento, certificación ni prueba causal.",
        "impact.title": "Catalizador de Impacto Global",
        "offline.available": "Disponible sin conexión",
        "status.needs_attention": "Requiere atención",
        "status.ready": "Listo"
      },
      "metadata": {
        "seeded": true
      }
    },
    {
      "locale_code": "fr",
      "workspace_id": null,
      "name": "Français",
      "direction": "ltr",
      "fallback_locale": "en-US",
      "active": true,
      "created_at": "2026-07-17T23:25:16.547953+00:00",
      "updated_at": "2026-07-17T23:25:16.547953+00:00",
      "translations": {
        "boundary.assurance": "Ce dossier ne constitue ni assurance, ni certification, ni preuve causale.",
        "impact.title": "Catalyseur d’impact mondial",
        "offline.available": "Disponible hors ligne",
        "status.needs_attention": "Nécessite une attention",
        "status.ready": "Prêt"
      },
      "metadata": {
        "seeded": true
      }
    }
  ],
  "offline_packages": [
    {
      "package_id": "gic-offline-c7dd57e9f68ac713d0f7",
      "workspace_id": "gic-workspace-bdc75d8b68333af2",
      "locale_code": "en-US",
      "package_version": "1.10.0",
      "source_hash": "e6c3abddd9f5951fe2a7713b7b39c362f32d54fa447a0b05285afdcd5f0c1689",
      "package_hash": "bcc33413730fb23a8b0b2132b58fac95827bb2daed3acc3b93b63fba8b5a39c5",
      "status": "ready",
      "created_at": "2026-07-17T23:30:00+00:00",
      "expires_at": "2026-08-16T23:30:00+00:00",
      "manifest": {
        "boundary": "Offline copies remain governed snapshots. Synchronization must pass revision and validation controls.",
        "contract_count": 1,
        "created_at": "2026-07-17T23:30:00+00:00",
        "expires_at": "2026-08-16T23:30:00+00:00",
        "locale_code": "en-US",
        "package_type": "global_impact_offline_package",
        "package_version": "1.10.0",
        "source_hash": "e6c3abddd9f5951fe2a7713b7b39c362f32d54fa447a0b05285afdcd5f0c1689",
        "workspace_id": "gic-workspace-bdc75d8b68333af2"
      },
      "payload": {
        "analysis_repository": {
          "analysis_runs": [],
          "benchmarks": [],
          "boundary": "Analysis records improve transparency but do not create assurance, certification, causality, or verified forecasts.",
          "comparison_sets": [],
          "generated_at": "2026-07-17T23:25:16.568316+00:00",
          "integrity": {
            "analysis_run_count": 0,
            "benchmark_count": 0,
            "comparison_member_count": 0,
            "comparison_set_count": 0,
            "orphan_comparison_member_ids": [],
            "orphan_sensitivity_run_ids": [],
            "scenario_count": 0,
            "sensitivity_run_count": 0,
            "uncertainty_model_count": 0,
            "valid": true
          },
          "repository_type": "global_impact_analysis_repository",
          "repository_version": "1.7.0",
          "scenarios": [],
          "sensitivity_runs": [],
          "uncertainty_models": [],
          "workspace_id": "gic-workspace-bdc75d8b68333af2"
        },
        "contracts": [
          {
            "content_hash": "8732f953dfb976ea3a746b6d0150c24713a76a88b80fc332db8c77e1d27707a9",
            "contract": {
              "boundaries": [
                "This contract is not an ESG assurance opinion, SDG certification, regulatory filing, or audit finding.",
                "Derived progress does not establish causality, contribution, attribution, or comparative superiority.",
                "Claims depend on documented sources, method design, indicator definition, and human review.",
                "Validation checks contract consistency; it does not automatically verify truth or source authenticity."
              ],
              "contract_type": "global_impact_contract",
              "contract_version": "1.1.0",
              "created_at": "2026-07-17T20:00:00+00:00",
              "derived": {
                "claims": [
                  {
                    "claim_type": "progress_to_target_statement",
                    "confidence": "medium",
                    "created_at": "2026-07-17T20:00:00+00:00",
                    "design_metadata": {
                      "causal_design": "",
                      "comparison_basis": "",
                      "contribution_rationale": "",
                      "design_type": "before_after"
                    },
                    "eligibility": {
                      "blocking_issue_ids": [],
                      "eligible": true
                    },
                    "entity_type": "claim",
                    "evidence_refs": [
                      "gic-source-f2284ef9ae098b56",
                      "gic-method-dfc0b951aac86076",
                      "gic-baseline-bccde48f17ee3898",
                      "gic-observation-cca59978f04bb0dd",
                      "gic-target-61bc37e9887a3252"
                    ],
                    "id": "gic-claim-36fcd07621180653",
                    "statement": "Estimated progress to target for Average monthly bill reduction is 60.00%.",
                    "updated_at": "2026-07-17T20:00:00+00:00"
                  }
                ],
                "interpretations": [
                  {
                    "created_at": "2026-07-17T20:00:00+00:00",
                    "entity_type": "interpretation",
                    "evidence_refs": [
                      "gic-baseline-bccde48f17ee3898",
                      "gic-observation-cca59978f04bb0dd",
                      "gic-target-61bc37e9887a3252"
                    ],
                    "id": "gic-interpretation-fc8f22a961341a46",
                    "interpretation_type": "metric_interpretation",
                    "text": "Average monthly bill reduction changed from 0 USD in 2025 baseline to 18 USD in 2026 Q2.",
                    "updated_at": "2026-07-17T20:00:00+00:00"
                  },
                  {
                    "created_at": "2026-07-17T20:00:00+00:00",
                    "entity_type": "interpretation",
                    "evidence_refs": [
                      "gic-baseline-bccde48f17ee3898",
                      "gic-observation-cca59978f04bb0dd",
                      "gic-target-61bc37e9887a3252"
                    ],
                    "id": "gic-interpretation-f98f1df0603418b3",
                    "interpretation_type": "metric_interpretation",
                    "text": "Progress must be interpreted against the indicator definition, source, method, population, geography, confidence, and review status.",
                    "updated_at": "2026-07-17T20:00:00+00:00"
                  },
                  {
                    "created_at": "2026-07-17T20:00:00+00:00",
                    "entity_type": "interpretation",
                    "evidence_refs": [
                      "gic-baseline-bccde48f17ee3898",
                      "gic-observation-cca59978f04bb0dd",
                      "gic-target-61bc37e9887a3252"
                    ],
                    "id": "gic-interpretation-fa8f1f835f341720",
                    "interpretation_type": "metric_interpretation",
                    "text": "Estimated progress to target is 60.00%.",
                    "updated_at": "2026-07-17T20:00:00+00:00"
                  }
                ],
                "metrics": {
                  "absolute_change": 18.0,
                  "calculation_method": {
                    "engine": "global-impact-catalyst",
                    "engine_version": "1.1.0",
                    "progress_formula": "direction-aware change from baseline divided by baseline-to-target distance",
                    "rounding": "decimal half up"
                  },
                  "cost_per_beneficiary": {
                    "currency": "USD",
                    "value": 297.62
                  },
                  "data_quality_components": {
                    "confidence_signal": 15,
                    "method_documented": 25,
                    "review_signal": 10,
                    "source_documented": 25
                  },
                  "data_quality_score": 75,
                  "percent_change_from_baseline": null,
                  "progress_to_target_percent": 60.0,